type,text,answer,url
open_ended,Why are nitrous oxide emissions from hydroponic systems generally lower compared to field cultivation?,"Nitrous oxide emissions from hydroponic systems are generally lower than field cultivation because hydroponic systems allow for more controlled and precise irrigation and nutrient application, creating more aerobic conditions in the root zones. This minimizes conditions favorable for denitrification processes that are major contributors to N2O emissions. Additionally, the use of inert substrates like rock wool can further reduce emissions by avoiding the organic matter content that fuels microbial activity responsible for N2O production.",https://www.frontiersin.org/journals/sustainable-food-systems/articles/10.3389/fsufs.2021.626053/full
open_ended,Discuss the implications of finding Pseudomonas as the most abundant genus in the hydroponic microgreen farm.,"The presence of Pseudomonas as the most abundant genus in the hydroponic microgreen farm has several implications. Firstly, while some Pseudomonas species are known for promoting plant growth, others can be pathogens to plants, and some can spoil food. This could potentially lead to issues with plant health and food safety if pathogenic or spoilage species are prevalent. Additionally, the dominance of Pseudomonas could indicate specific environmental conditions or nutrient profiles that favor this genus, which might need to be adjusted to promote a more balanced microbial ecosystem. Lastly, the presence of Pseudomonas highlights the importance of continuous monitoring and possibly implementing control measures to manage the microbial population in hydroponic systems to ensure both plant health and food safety.",https://www.frontiersin.org/journals/microbiology/articles/10.3389/fmicb.2022.879260/full
open_ended,How does MeJA treatment influence the phenolic content in substrate-grown Chinese chives compared to hydroponic Chinese chives?,"MeJA treatment significantly increased the phenolic content of substrate-grown Chinese chives, while in hydroponic Chinese chives, the phenolic content also increased but the extent was less compared to substrate-grown ones.",https://www.frontiersin.org/journals/nutrition/articles/10.3389/fnut.2022.859035/full
open_ended,What are the implications of different root exudate profiles between hydroponically-grown and field-grown plants for agricultural practices?,"The differences in root exudate profiles between hydroponically-grown and field-grown plants suggest that the method of cultivation can significantly influence the types and amounts of metabolites exuded by roots. This has implications for agricultural practices as it affects plant interactions with soil microbes and nutrient availability. Understanding these differences can help in developing cultivation practices that optimize plant health and soil fertility, especially in sustainable agriculture settings where natural interactions are crucial.",https://www.frontiersin.org/journals/plant-science/articles/10.3389/fpls.2023.1122285/full
open_ended,How do plant growth-promoting microorganisms (PGPMs) enhance the photosynthetic activity of hydroponically grown soybean?,"PGPMs induce changes in leaf functional anatomical traits such as higher density of smaller stomata, thicker palisade parenchyma, and larger intercellular spaces in the mesophyll. These modifications improve gas exchanges and photosynthetic efficiency, leading to increased photosynthetic activity and enhanced plant growth.",https://www.frontiersin.org/journals/plant-science/articles/10.3389/fpls.2017.00674/full
open_ended,How does the BiFPN structure improve the feature fusion in the YOLOv5 model according to the study?,"The BiFPN structure in the YOLOv5 model establishes bidirectional cross-scale connections, which incorporate learnable weights to enhance feature fusion and improve detection accuracy by better understanding the importance of various input features.",https://www.frontiersin.org/journals/plant-science/articles/10.3389/fpls.2023.1242337/full
open_ended,"Explain how the expression of transcription factors such as PIF, MYC, ERF, TGA, and ARF is related to callus formation in Pinellia ternata hydroponic cuttings.","Transcription factors like PIF, MYC, ERF, TGA, and ARF play key regulatory roles during callus formation in Pinellia ternata. These factors are involved in the regulation of gene networks that control hormone synthesis and signaling pathways. For instance, PIF4 regulates auxin genes that affect downstream signal transduction, influencing cell elongation and differentiation. ERF and MYC transcription factors are involved in stress responses, and their modulation can impact JA signaling and plant growth under stress. ARF transcription factors are crucial in auxin signaling, helping to regulate the expression of downstream genes required for cell proliferation and callus development. Overall, these transcription factors contribute to the complex hormonal and transcriptional regulation necessary for effective callus formation and subsequent plant regeneration.",https://www.frontiersin.org/journals/plant-science/articles/10.3389/fpls.2023.1189499/full
open_ended,Discuss how the use of RUW for HBF production might impact the sustainability of water resources in agriculture.,"The use of reclaimed urban wastewater (RUW) for hydroponic barley forage (HBF) production could significantly enhance the sustainability of water resources in agriculture by providing a reliable alternative to freshwater, especially in areas facing water scarcity. By recycling wastewater, the demand on freshwater resources is reduced, which helps in conserving water for other essential uses. Additionally, this practice can help in managing wastewater effectively, reducing environmental pollution from wastewater discharge, and providing nutrients to the crops, which may decrease the need for synthetic fertilizers.",https://www.frontiersin.org/journals/veterinary-science/articles/10.3389/fvets.2023.1274466/full
open_ended,Discuss the implications of the presence of Stenotrophomonas maltophilia in hydroponically grown vegetables for public health.,"The presence of Stenotrophomonas maltophilia in hydroponically grown vegetables poses significant public health risks, particularly for immunocompromised individuals, as the pathogen is resistant to multiple drugs and capable of forming biofilms, enhancing its survivability and potential for infection. The study highlights the need for effective microbial control measures in hydroponic farming to prevent the contamination of leafy greens, which are often consumed raw. Ensuring microbial safety in these systems is crucial to prevent potential foodborne outbreaks.",https://www.frontiersin.org/journals/microbiology/articles/10.3389/fmicb.2019.02718/full
open_ended,Explain how the 'tip-wick' system is assembled and its significance for small model plants like Lotus japonicus in studying AM symbiosis.,"The 'tip-wick' system is assembled using a tip-rack for 1 ml pipette tips, rockwool, aluminum foil, and L. japonicus seedlings. The rack is covered with aluminum foil to prevent light exposure and algae growth. Rockwool is inserted into cut 1 ml pipette tips, acting as a wick to deliver liquid media to the plant. Five hundred spores per tip are placed on top of each rockwool wick, followed by transplanting the seedlings into the tips with additional rockwool to support and guide roots into the nutrient solution. This system is significant for studying AM symbiosis in small model plants as it allows for controlled nutrient conditions, easy monitoring of root growth, and efficient root colonization, essential for investigating the molecular mechanisms of AM development and function.",https://www.frontiersin.org/journals/plant-science/articles/10.3389/fpls.2020.00063/full
